산업 자동화 소프트웨어 시장: 2022년에 대한 3가지 대담한 전망 ..., AMA Research의 최근 추가된 산업용 자동화 소프트웨어 시장 조사 연구는 2027년까지의 자세한 전망과 정교한 시장 검토를 제공합니다. 시장 조사는 시장화를 가속화..., https://osaek.info/%EC%86%8C%EC%8B%9D/%EC%82%B0%EC%97%85-%EC%9E%90%EB%8F%99%ED%99%94-%EC%86%8C%ED%94%84%ED%8A%B8%EC%9B%A8%EC%96%B4-%EC%8B%9C%EC%9E%A5-2022%EB%85%84%EC%97%90-%EB%8C%80%ED%95%9C-3%EA%B0%80%EC%A7%80-%EB%8C%80%EB%8B%B4/34008/ 
세일포인트 “AI 기반 자동화된 아이덴티티 보안 방식으로 변화 ..., “이제는 인간의 능력으로 관리하기에는 너무 많은 아이덴티티가 존재하기 때문에 도구 특히 자동화된 도구화에 의존해야 한다.” 글로벌 엔터프라이즈 아이덴티티 보안..., https://byline.network/2022/10/28-251/ 
[로보월드] 자동차 시트 프레임 검사 자동화 작업자 부담 낮춰, [로보월드] 자동차 시트 프레임 검사 자동화 작업자 부담 낮춰. 로봇에 카메라 부착해 치수 패드 부착 등 확인. 기사입력 2022-10-28 17:15:58., https://www.kidd.co.kr/news/229877 
[AI 기반 제조혁신-②] 조선업계 업황 개선에 인력 부족은 더욱 ..., 조선3사의 경우 이러한 인력난을 타개하기 위해 최근 무인자율운향 스마트조선소를 추진하고 있다. 특히 많은 용접 작업이 수행되는 공정 특성상 용접용 로봇 자동화..., https://www.hellot.net/news/article.html?no=72267 
롯데홈쇼핑 이천 물류센터 오픈...로봇기반 첨단 자동화시스템 도입, 이들은 오픈식 이후 물류센터를 함께 둘러보고 자동화 설비를 시연하는 투어를 진행했다. 이 대표는 축사를 통해 “자동화 물류 시스템 도입은 롯데홈쇼핑의 물류 역량을 한..., https://m.khan.co.kr/economy/market-trend/article/202210241415011 
로봇·오토라벨러·디팔렛타이저 등 홈쇼핑 업계 최초 자동화 시스템 구축 - 조선일보, 롯데홈쇼핑은 지난 21일 물류센터를 기존 경기도 군포에서 이천으로 확장 이전하고 홈쇼핑 업계 최초로 자동화 시스템을 구축했다., https://www.chosun.com/special/special_section/2022/10/27/YQQ7SKPVSFHJZAV24MIMZEW65U/ 
워크로드 자동화 소프트웨어 시장 2022 규모 공유 분석 및 ..., 글로벌 워크로드 자동화 소프트웨어 시장 규모 연구 보고서 2022는 시장의 미래 전망 및 현재 전망을 이해하기 위한 수익 성장 시장 정의 세분화 산업 잠재력..., https://osaek.info/%EC%86%8C%EC%8B%9D/%EC%9B%8C%ED%81%AC%EB%A1%9C%EB%93%9C-%EC%9E%90%EB%8F%99%ED%99%94-%EC%86%8C%ED%94%84%ED%8A%B8%EC%9B%A8%EC%96%B4-%EC%8B%9C%EC%9E%A5-2022-%EA%B7%9C%EB%AA%A8-%EA%B3%B5%EC%9C%A0-%EB%B6%84%EC%84%9D/32234/ 
MS의 B2B 전략 '초자동화 통한 생산성의 극대화' (이그나이트 ..., 초자동화는 품질 주기 시간 효율성 또는 민첩성에 중점을 둔 구현 기술과 결합된 비즈니스 프로세스를 융합하는 것이다. 이 모든 기반의 근간에는 데이터를 어떻게..., https://slownews.kr/87361 
도서관 자동화 서비스 시스템 시장 최고 제조업체 분석 | 2030년 ..., 2022년 시장은 도서관 자동화 서비스 시스템에게 또 다른 중요한 해가 될 수 있습니다. 이 보고서는 회사의 활동 및 재무 상태(자본을 늘리거나 투자자를 확보하려는 경우..., https://osaek.info/%EC%86%8C%EC%8B%9D/%EB%8F%84%EC%84%9C%EA%B4%80-%EC%9E%90%EB%8F%99%ED%99%94-%EC%84%9C%EB%B9%84%EC%8A%A4-%EC%8B%9C%EC%8A%A4%ED%85%9C-%EC%8B%9C%EC%9E%A5-%EC%B5%9C%EA%B3%A0-%EC%A0%9C%EC%A1%B0%EC%97%85%EC%B2%B4-%EB%B6%84/31108/ 
[비즈&] 롯데홈쇼핑 물류센터에 업계 최초 자동화 시스템 도입 外, 롯데홈쇼핑이 경기도 이천에 업계 최초로 자동화 시스템을 도입한 물류센터를 열었습니다. 자율주행 기반의 로봇을 도입하고 8134평 규모의 단층 구조 원라인 시스템으로..., https://m.yonhapnewstv.co.kr/news/MYH20221025012900038 
